{"backend":{"adapter_version":"1.0.0","application_version":"Python 3.11.17","device":"cpu","executable_sha256":"ff9b2ac4362b81c68622ffb1730f7138eb269177d9846399c521a44c5daffb0e","id":"pybullet","platform":"Linux-7.2.5-3-omarchy-x86_64-with-glibc2.44","precision":"mixed","solver_name":"PyBullet DIRECT (bundled Bullet)","solver_version":"PyBullet 3.2.7"},"files":[{"bytes":10924,"path":"contacts.json","sha256":"26672e9365ed9eb8a4bf06c29393fd0aef1e94400c97ab44109c101467acaf1e"},{"bytes":1172,"path":"inputs/ball-asset.json","sha256":"d1e6f820df1a509904502c8d0418795aa8465e793f4e213cb1327154d61d5fe0"},{"bytes":185,"path":"inputs/ball.obj","sha256":"a76c16429d620f0a129045d23c129037242e643b7b5ae97c4e9095895aa45d4d"},{"bytes":1178,"path":"inputs/floor-asset.json","sha256":"03340d7131b3cdbe5b3b14191ea0f0e10e91ff98d8c0114c9db4c315da9424f6"},{"bytes":246,"path":"inputs/floor.obj","sha256":"ca83b0c7a0b76f7f579536924596c3807aef1bf96e38e5c9b775e2943b8eb23a"},{"bytes":2476,"path":"inputs/physics-scene.json","sha256":"48b938924c4971edd764e6648d7dc966c0e4afaa80663f8125fe00aa9827011f"},{"bytes":1962,"path":"inputs/project.json","sha256":"90f554eda48308c37f478ff99ab348a1b08b8d1860d522b5779a8aabb8178076"},{"bytes":1270,"path":"simulation-report.json","sha256":"2398e79ffab175cf6e6d718399626f425bf33e48e3a26d2f7f7bc7de791bec39"},{"bytes":42,"path":"simulation-stderr.log","sha256":"e35d107f1d6e99beca8bd3bf477a668f080e6dd52b8b519c32ac035fcd84d2d3"},{"bytes":0,"path":"simulation-stdout.log","sha256":"e3b0c44298fc1c149afbf4c8996fb92427ae41e4649b934ca495991b7852b855"},{"bytes":87951,"path":"solver-states.json","sha256":"12860cbaad37dbeb7c3a6049d4f7cf9f7ce5d392956b183b94d2d45f458c553e"},{"bytes":9170,"path":"states.json","sha256":"596c657cf439efd45f046f0b80758e0554473981ba350c1e5427695484fad32a"},{"bytes":9279,"path":"timing.json","sha256":"ec1a2b515eb29906eebb9a9b642b471711294ad70ebbcb8713f7ae6dce005df2"},{"bytes":2679,"path":"verification.json","sha256":"a79795e02d35ef305e72325ef66ae177e285fe7d4c18df83325d89f45f540309"},{"bytes":3892,"path":"worker-job.json","sha256":"2dd15cf6a0d368392e74c9a9e2517fa3f37c68aedcf13790d3c5c5a135be67b5"},{"bytes":1270,"path":"worker-report.json","sha256":"2398e79ffab175cf6e6d718399626f425bf33e48e3a26d2f7f7bc7de791bec39"},{"bytes":10441,"path":"worker.py","sha256":"4733ae5bee19a5a816c7c88d60451e04d5d957afe169ea0fe43fbb41e96f25e0"},{"bytes":3216,"path":"world.json","sha256":"c7baf20089094b067416e0f2d40c59080f5011850f5790c1da795fe4a4d3de6c"}],"fixed_step":{"denominator":240,"numerator":1},"fixture":true,"fps":{"denominator":1,"numerator":24},"frame_range":{"end":49,"start":0},"id":"cache-edf2c15ddb204ab8acc6a282515d502c","kind":"hatch-3d-physics-cache","numerical_tolerance":1e-05,"physics_input_sha256":"c7baf20089094b067416e0f2d40c59080f5011850f5790c1da795fe4a4d3de6c","reproducibility":"verified-cache-replay","review_status":"unreviewed","sample_count":49,"schema_version":1,"seed":1,"substeps":1,"upstream_hashes":["03340d7131b3cdbe5b3b14191ea0f0e10e91ff98d8c0114c9db4c315da9424f6","48b938924c4971edd764e6648d7dc966c0e4afaa80663f8125fe00aa9827011f","90f554eda48308c37f478ff99ab348a1b08b8d1860d522b5779a8aabb8178076","a76c16429d620f0a129045d23c129037242e643b7b5ae97c4e9095895aa45d4d","ca83b0c7a0b76f7f579536924596c3807aef1bf96e38e5c9b775e2943b8eb23a","d1e6f820df1a509904502c8d0418795aa8465e793f4e213cb1327154d61d5fe0"],"usage":{"elapsed_seconds":1.3207944119349122,"output_bytes":147353,"peak_memory_bytes":184942592,"solver_steps":480},"world_sha256":"c7baf20089094b067416e0f2d40c59080f5011850f5790c1da795fe4a4d3de6c"}