{"backend":{"adapter_version":"1.0.0","application_version":"Blender 4.5.3 LTS","device":"cpu","executable_sha256":"5e15447670804c855fef6033ac9b8fd82696b762095becf0df79b1c2f8034397","id":"blender","platform":"Linux-7.2.5-3-omarchy-x86_64-with-glibc2.44","precision":"mixed","solver_name":"Blender Bullet rigid-body world","solver_version":"not exposed separately by Blender"},"files":[{"bytes":121,"path":".config/blender/4.5/extensions/.cache/compat.dat","sha256":"44735ebe19fd99c11e4ef256dd6a3d9a4da67fcb581868efde84d2ae14b6e5d7"},{"bytes":1172,"path":"inputs/ball-asset.json","sha256":"d1e6f820df1a509904502c8d0418795aa8465e793f4e213cb1327154d61d5fe0"},{"bytes":185,"path":"inputs/ball.obj","sha256":"a76c16429d620f0a129045d23c129037242e643b7b5ae97c4e9095895aa45d4d"},{"bytes":1178,"path":"inputs/floor-asset.json","sha256":"03340d7131b3cdbe5b3b14191ea0f0e10e91ff98d8c0114c9db4c315da9424f6"},{"bytes":246,"path":"inputs/floor.obj","sha256":"ca83b0c7a0b76f7f579536924596c3807aef1bf96e38e5c9b775e2943b8eb23a"},{"bytes":2476,"path":"inputs/physics-scene.json","sha256":"48b938924c4971edd764e6648d7dc966c0e4afaa80663f8125fe00aa9827011f"},{"bytes":1962,"path":"inputs/project.json","sha256":"90f554eda48308c37f478ff99ab348a1b08b8d1860d522b5779a8aabb8178076"},{"bytes":10147,"path":"preview.png","sha256":"9b3348195ce5b9e38e3acfb884d803a7ebe0ed830c4e0cfc4f6c13719cafa04e"},{"bytes":0,"path":"reopen-stderr.log","sha256":"e3b0c44298fc1c149afbf4c8996fb92427ae41e4649b934ca495991b7852b855"},{"bytes":141,"path":"reopen-stdout.log","sha256":"9238f6448a2932f1be02be54e9b88448575ed68185b9e4e253d69c3883658e8a"},{"bytes":412828,"path":"scene.blend","sha256":"202581c7da3fbcad334d4156b354ce7492fba804b8a4b513f5dc04ba119d4eea"},{"bytes":1918,"path":"simulation-report.json","sha256":"21ad4ff0276545f17e19af9e16264f392933519cc858eb59078342925a74826e"},{"bytes":0,"path":"simulation-stderr.log","sha256":"e3b0c44298fc1c149afbf4c8996fb92427ae41e4649b934ca495991b7852b855"},{"bytes":6409,"path":"simulation-stdout.log","sha256":"9caea953d26c2d441e4fc8ca42c3083841b548f91ecb74fb0f151cbbac13ca4e"},{"bytes":9569,"path":"states.json","sha256":"71c359069788bba3a1852393cc2238c07257e14f4287b7eec34d090a21ed290f"},{"bytes":9307,"path":"timing.json","sha256":"84fab852ab144783990d2a15a9da84c68e326c9d546919959be92ed46127cf83"},{"bytes":3827,"path":"verification.json","sha256":"b13de1053eed26f175b0735be7b1d425edc627f298e6f8d37cf734eb9f6dd58e"},{"bytes":3840,"path":"worker-job.json","sha256":"f081f46740455f8d9fcbab3800399ce104f324360c6be76c45c8f090f84fd446"},{"bytes":761,"path":"worker-report.json","sha256":"4964b8f61e4f65671306a53f3ae7e7d13af6e60df949d1e9a97ed3bb80f8ab04"},{"bytes":18951,"path":"worker.py","sha256":"4f2746f379cc9eedee4e798799c7de7804acf221623182f4ae1604d63a72cf0f"},{"bytes":3164,"path":"world.json","sha256":"1174afd8aa90cc3565fc7dfcde62022304cb937366755d9e9c0e515120fef692"}],"fixed_step":{"denominator":240,"numerator":1},"fixture":true,"fps":{"denominator":1,"numerator":24},"frame_range":{"end":49,"start":0},"id":"cache-a56ea7b897c948848975b91ce8cd9a4f","kind":"hatch-3d-physics-cache","numerical_tolerance":1e-05,"physics_input_sha256":"1174afd8aa90cc3565fc7dfcde62022304cb937366755d9e9c0e515120fef692","reproducibility":"verified-cache-replay","review_status":"unreviewed","sample_count":49,"schema_version":1,"seed":1,"substeps":1,"upstream_hashes":["03340d7131b3cdbe5b3b14191ea0f0e10e91ff98d8c0114c9db4c315da9424f6","48b938924c4971edd764e6648d7dc966c0e4afaa80663f8125fe00aa9827011f","90f554eda48308c37f478ff99ab348a1b08b8d1860d522b5779a8aabb8178076","a76c16429d620f0a129045d23c129037242e643b7b5ae97c4e9095895aa45d4d","ca83b0c7a0b76f7f579536924596c3807aef1bf96e38e5c9b775e2943b8eb23a","d1e6f820df1a509904502c8d0418795aa8465e793f4e213cb1327154d61d5fe0"],"usage":{"elapsed_seconds":7.0303884480381384,"output_bytes":488202,"peak_memory_bytes":403836928,"solver_steps":480},"world_sha256":"1174afd8aa90cc3565fc7dfcde62022304cb937366755d9e9c0e515120fef692"}