{"backend":{"adapter_version":"1.0.0","application_version":"Python 3.11.17","device":"cpu","executable_sha256":"ff9b2ac4362b81c68622ffb1730f7138eb269177d9846399c521a44c5daffb0e","id":"pybullet","platform":"Linux-7.2.5-3-omarchy-x86_64-with-glibc2.44","precision":"mixed","solver_name":"PyBullet DIRECT (bundled Bullet)","solver_version":"PyBullet 3.2.7"},"files":[{"bytes":10991,"path":"contacts.json","sha256":"b55cdf126483b90ef03d6f54647e9ba9967d15ba1b2efc5cc5b34da0b8690c32"},{"bytes":1172,"path":"inputs/ball-asset.json","sha256":"d1e6f820df1a509904502c8d0418795aa8465e793f4e213cb1327154d61d5fe0"},{"bytes":185,"path":"inputs/ball.obj","sha256":"a76c16429d620f0a129045d23c129037242e643b7b5ae97c4e9095895aa45d4d"},{"bytes":1178,"path":"inputs/floor-asset.json","sha256":"03340d7131b3cdbe5b3b14191ea0f0e10e91ff98d8c0114c9db4c315da9424f6"},{"bytes":246,"path":"inputs/floor.obj","sha256":"ca83b0c7a0b76f7f579536924596c3807aef1bf96e38e5c9b775e2943b8eb23a"},{"bytes":2476,"path":"inputs/physics-scene.json","sha256":"48b938924c4971edd764e6648d7dc966c0e4afaa80663f8125fe00aa9827011f"},{"bytes":1962,"path":"inputs/project.json","sha256":"90f554eda48308c37f478ff99ab348a1b08b8d1860d522b5779a8aabb8178076"},{"bytes":1271,"path":"simulation-report.json","sha256":"b2f4fd3f4d2c42c1b77f6a620be47482705eb8794ac0a648f9f3aadbfd58f21d"},{"bytes":42,"path":"simulation-stderr.log","sha256":"e35d107f1d6e99beca8bd3bf477a668f080e6dd52b8b519c32ac035fcd84d2d3"},{"bytes":0,"path":"simulation-stdout.log","sha256":"e3b0c44298fc1c149afbf4c8996fb92427ae41e4649b934ca495991b7852b855"},{"bytes":175546,"path":"solver-states.json","sha256":"e870725af31f5b2589f1969ed8eea09034d584c6ebdca7c96be4c4b331105b34"},{"bytes":9161,"path":"states.json","sha256":"38bd074b163465002f47cc3d27e68b372e81aca109445580b5d3f0b9bcd1ddda"},{"bytes":9341,"path":"timing.json","sha256":"e8fdf08ac350064dab806132f767a791c2d485e0e0f410828c76748c1515cf37"},{"bytes":2680,"path":"verification.json","sha256":"d98a8578e104c54c2b3ee3a1be70b98ea6f7685440f00f5b7632adcee7dcb21b"},{"bytes":3944,"path":"worker-job.json","sha256":"47b7bd144e32de57d0ec19c4323431fe6f714233ff9021457ea3479f24c74a9b"},{"bytes":1271,"path":"worker-report.json","sha256":"b2f4fd3f4d2c42c1b77f6a620be47482705eb8794ac0a648f9f3aadbfd58f21d"},{"bytes":10441,"path":"worker.py","sha256":"4733ae5bee19a5a816c7c88d60451e04d5d957afe169ea0fe43fbb41e96f25e0"},{"bytes":3268,"path":"world.json","sha256":"34343b8b3ec06ff4660f5af6a74b8d2e4060ec1ab8b9e8d263f3696acbbf2062"}],"fixed_step":{"denominator":240,"numerator":1},"fixture":true,"fps":{"denominator":1,"numerator":24},"frame_range":{"end":49,"start":0},"id":"cache-a60df4cabe154fb492a2b44ff3e02dd0","kind":"hatch-3d-physics-cache","numerical_tolerance":1e-05,"physics_input_sha256":"34343b8b3ec06ff4660f5af6a74b8d2e4060ec1ab8b9e8d263f3696acbbf2062","reproducibility":"verified-cache-replay","review_status":"unreviewed","sample_count":49,"schema_version":1,"seed":1,"substeps":2,"upstream_hashes":["03340d7131b3cdbe5b3b14191ea0f0e10e91ff98d8c0114c9db4c315da9424f6","48b938924c4971edd764e6648d7dc966c0e4afaa80663f8125fe00aa9827011f","90f554eda48308c37f478ff99ab348a1b08b8d1860d522b5779a8aabb8178076","a76c16429d620f0a129045d23c129037242e643b7b5ae97c4e9095895aa45d4d","ca83b0c7a0b76f7f579536924596c3807aef1bf96e38e5c9b775e2943b8eb23a","d1e6f820df1a509904502c8d0418795aa8465e793f4e213cb1327154d61d5fe0"],"usage":{"elapsed_seconds":1.4498274569632486,"output_bytes":235175,"peak_memory_bytes":185016320,"solver_steps":960},"world_sha256":"34343b8b3ec06ff4660f5af6a74b8d2e4060ec1ab8b9e8d263f3696acbbf2062"}